{
  "type": "KalshiMarketBrief",
  "version": 1,
  "briefId": "KXMAMDANIEO-26OCT03@20261003T201512Z",
  "asOf": "2026-10-03T20:15:12.469Z",
  "event": {
    "eventTicker": "KXMAMDANIEO-26OCT03",
    "seriesTicker": "KXMAMDANIEO",
    "title": "Will Mamdani sign an executive order this week? (9/27 - 10/3)",
    "subTitle": "From Sep 27, 2026 to Oct 3, 2026",
    "category": "Politics",
    "frequency": "one_off",
    "mutuallyExclusive": false,
    "tags": [
      "NYC"
    ],
    "closesAt": "2026-10-04T13:59:00.000Z",
    "expectedSettleAt": "2027-01-01T14:00:00.000Z",
    "settlesOn": "2027-01-01",
    "hoursToClose": 17.73,
    "feeMultiplier": 1,
    "url": "https://kalshi.com/markets/kxmamdanieo/will-mamdani-sign-an-executive-order/kxmamdanieo-26oct03",
    "seriesUrl": "https://kalshi.com/markets/kxmamdanieo"
  },
  "rules": {
    "primary": "If the number of non-emergency executive orders signed by Zohran Mamdani is above 0 from Sep 27, 2026 to Oct 3, 2026, then the market resolves to Yes.",
    "secondary": "",
    "contractTermsUrl": "https://assets.kalshi.com/contract_terms/POLITICALSTAT.pdf"
  },
  "settlementSource": {
    "primary": {
      "name": "NYC Mayor's Office",
      "url": "https://www.nyc.gov/mayors-office/news/?types=executive-orders&"
    },
    "all": [
      {
        "name": "NYC Mayor's Office",
        "url": "https://www.nyc.gov/mayors-office/news/?types=executive-orders&"
      }
    ]
  },
  "markets": [
    {
      "ticker": "KXMAMDANIEO-26OCT03-T0",
      "label": "Above 0",
      "strike": {
        "type": "greater",
        "floor": 0,
        "cap": null
      },
      "yesBidCents": 1,
      "yesAskCents": 2,
      "noBidCents": 98,
      "noAskCents": 99,
      "lastCents": 1,
      "bidSize": 1364.19,
      "askSize": 2840.82,
      "volume": 11174.38,
      "volume24h": 8322.41,
      "openInterest": 6046.43,
      "impliedYes": 0.015,
      "impliedYesNormalized": null,
      "house": null,
      "baseRate": {
        "band": "longshot",
        "scope": "category",
        "category": "Politics",
        "horizonHours": 24,
        "n": 41,
        "yesCount": 2,
        "yesRate": 0.0488,
        "yesRate95": [
          0.0135,
          0.1614
        ],
        "avgYesAsk": 0.0341
      }
    }
  ],
  "book": {
    "markets": 1,
    "volume24h": 8322.41,
    "openInterest": 6046.43,
    "midSum": 0.015
  },
  "house": {
    "model": null,
    "status": "no-model",
    "reason": "the house has no model for this market; the brief carries market-implied odds and the category base rate",
    "evidence": [],
    "usableAs": null
  },
  "baseRate": {
    "category": {
      "category": "Politics",
      "horizonHours": 24,
      "markets": 119,
      "brierOfMid": 0.0809,
      "longshot": {
        "n": 41,
        "yesCount": 2,
        "yesRate": 0.0488,
        "yesRate95": [
          0.0135,
          0.1614
        ],
        "avgYesAsk": 0.0341
      },
      "favorite": {
        "n": 8,
        "yesCount": 8,
        "yesRate": 1,
        "yesRate95": [
          0.6756,
          1
        ],
        "avgYesAsk": 0.9716
      },
      "source": "content/config/kalshi-category-base-rates.json",
      "window": [
        "2026-09-29",
        "2026-10-03"
      ]
    },
    "family": null
  },
  "whatWouldMoveIt": [
    "New polling, official announcements or filings, and statements by the named officials.",
    "The publication schedule of the named poll or tracker.",
    "A rules clarification or settlement-source change published by Kalshi on the market page.",
    "Order-book depth: thin books move on small orders, so a large price move on little volume says little."
  ],
  "opportunities": [],
  "provenance": [
    {
      "what": "Kalshi market data (event, markets, series)",
      "url": "https://api.elections.kalshi.com/trade-api/v2/events/KXMAMDANIEO-26OCT03",
      "fetchedAt": "2026-10-03T20:15:12.469Z"
    },
    {
      "what": "Category base rates",
      "url": null,
      "fetchedAt": "2026-10-03"
    }
  ],
  "disclosure": "Built from public information (Kalshi market data, the contract rules, and public data sources). Odds are a snapshot, not a prediction of the future and not financial advice. Prediction-market contracts can lose their entire price."
}
