{
  "type": "KalshiMarketBrief",
  "version": 1,
  "briefId": "KXTRUMPUFC-26OCT@20261003T201512Z",
  "asOf": "2026-10-03T20:15:12.469Z",
  "event": {
    "eventTicker": "KXTRUMPUFC-26OCT",
    "seriesTicker": "KXTRUMPUFC",
    "title": "Will Donald Trump attend UFC 332?",
    "subTitle": "On Oct 3, 2026",
    "category": "Politics",
    "frequency": "one_off",
    "mutuallyExclusive": false,
    "tags": [
      "Trump"
    ],
    "closesAt": "2026-10-04T14:00:00.000Z",
    "expectedSettleAt": "2026-10-04T14:00:00.000Z",
    "settlesOn": "2026-10-04",
    "hoursToClose": 17.75,
    "feeMultiplier": 1,
    "url": "https://kalshi.com/markets/kxtrumpufc/trump-attend-another-ufc-event-this-year/kxtrumpufc-26oct",
    "seriesUrl": "https://kalshi.com/markets/kxtrumpufc"
  },
  "rules": {
    "primary": "If Donald Trump attends UFC 332, then the market resolves to Yes.",
    "secondary": "Attendance is confirmed if the person is reported present at the event by any Source Agency, including social media posts by the person themselves. Brief appearances or partial attendance count as attendance. Kalshi is not affiliated, associated, authorized, endorsed by, or in any way officially connected with the Ultimate Fighting Championship (UFC) or TKO Group Holdings. All trademarks, logos, and brand names are the property of their respective owners.",
    "contractTermsUrl": "https://assets.kalshi.com/contract_terms/ATTEND.pdf"
  },
  "settlementSource": {
    "primary": {
      "name": "USA Today",
      "url": "https://www.usatoday.com/"
    },
    "all": [
      {
        "name": "USA Today",
        "url": "https://www.usatoday.com/"
      },
      {
        "name": "ABC",
        "url": "https://abcnews.go.com/"
      },
      {
        "name": "Fox News",
        "url": "https://www.foxnews.com/"
      },
      {
        "name": "MSNBC",
        "url": "https://www.msnbc.com/"
      },
      {
        "name": "The Wall Street Journal",
        "url": "https://www.wsj.com/"
      },
      {
        "name": "Semafor",
        "url": "https://www.semafor.com/"
      },
      {
        "name": "The Information",
        "url": "https://www.theinformation.com/"
      },
      {
        "name": "CBS",
        "url": "https://www.cbsnews.com/"
      },
      {
        "name": "Vogue",
        "url": "https://www.vogue.com/"
      },
      {
        "name": "Axios",
        "url": "https://www.axios.com/"
      },
      {
        "name": "CNN",
        "url": "https://www.cnn.com/"
      },
      {
        "name": "Reuters",
        "url": "https://www.reuters.com/"
      },
      {
        "name": "Billboard",
        "url": "https://www.billboard.com/charts/hot-100/"
      },
      {
        "name": "The New York Times",
        "url": "https://www.nytimes.com/"
      },
      {
        "name": "The Washington Post",
        "url": "https://www.washingtonpost.com/"
      },
      {
        "name": "the Associated Press",
        "url": "https://apnews.com/"
      },
      {
        "name": "Politico",
        "url": "https://www.politico.com/"
      }
    ]
  },
  "markets": [
    {
      "ticker": "KXTRUMPUFC-26OCT-DJT",
      "label": "Yes",
      "strike": {
        "type": null,
        "floor": null,
        "cap": null
      },
      "yesBidCents": 0,
      "yesAskCents": 1,
      "noBidCents": 99,
      "noAskCents": 100,
      "lastCents": 1,
      "bidSize": 0,
      "askSize": 285481.88,
      "volume": 221865.78,
      "volume24h": 47582.4,
      "openInterest": 152127.4,
      "impliedYes": 0.005,
      "impliedYesNormalized": null,
      "house": null,
      "baseRate": {
        "band": "longshot",
        "scope": "category",
        "category": "Politics",
        "horizonHours": 24,
        "n": 41,
        "yesCount": 2,
        "yesRate": 0.0488,
        "yesRate95": [
          0.0135,
          0.1614
        ],
        "avgYesAsk": 0.0341
      }
    }
  ],
  "book": {
    "markets": 1,
    "volume24h": 47582.4,
    "openInterest": 152127.4,
    "midSum": 0.005
  },
  "house": {
    "model": null,
    "status": "no-model",
    "reason": "the house has no model for this market; the brief carries market-implied odds and the category base rate",
    "evidence": [],
    "usableAs": null
  },
  "baseRate": {
    "category": {
      "category": "Politics",
      "horizonHours": 24,
      "markets": 119,
      "brierOfMid": 0.0809,
      "longshot": {
        "n": 41,
        "yesCount": 2,
        "yesRate": 0.0488,
        "yesRate95": [
          0.0135,
          0.1614
        ],
        "avgYesAsk": 0.0341
      },
      "favorite": {
        "n": 8,
        "yesCount": 8,
        "yesRate": 1,
        "yesRate95": [
          0.6756,
          1
        ],
        "avgYesAsk": 0.9716
      },
      "source": "content/config/kalshi-category-base-rates.json",
      "window": [
        "2026-09-29",
        "2026-10-03"
      ]
    },
    "family": null
  },
  "whatWouldMoveIt": [
    "New polling, official announcements or filings, and statements by the named officials.",
    "The publication schedule of the named poll or tracker.",
    "A rules clarification or settlement-source change published by Kalshi on the market page.",
    "Order-book depth: thin books move on small orders, so a large price move on little volume says little."
  ],
  "opportunities": [],
  "provenance": [
    {
      "what": "Kalshi market data (event, markets, series)",
      "url": "https://api.elections.kalshi.com/trade-api/v2/events/KXTRUMPUFC-26OCT",
      "fetchedAt": "2026-10-03T20:15:12.469Z"
    },
    {
      "what": "Category base rates",
      "url": null,
      "fetchedAt": "2026-10-03"
    }
  ],
  "disclosure": "Built from public information (Kalshi market data, the contract rules, and public data sources). Odds are a snapshot, not a prediction of the future and not financial advice. Prediction-market contracts can lose their entire price."
}
