{
  "type": "KalshiMarketBrief",
  "version": 1,
  "briefId": "KXTRUMPAPPROVE-26OCT04@20261003T201512Z",
  "asOf": "2026-10-03T20:15:12.469Z",
  "event": {
    "eventTicker": "KXTRUMPAPPROVE-26OCT04",
    "seriesTicker": "KXTRUMPAPPROVE",
    "title": "Trump's RCP approval average on Oct 4, 2026?",
    "subTitle": "On Oct 4, 2026",
    "category": "Politics",
    "frequency": "one_off",
    "mutuallyExclusive": true,
    "tags": [
      "Recurring"
    ],
    "closesAt": "2026-10-04T16:59:00.000Z",
    "expectedSettleAt": "2026-10-04T17:00:00.000Z",
    "settlesOn": "2026-10-04",
    "hoursToClose": 20.73,
    "feeMultiplier": 1,
    "url": "https://kalshi.com/markets/kxtrumpapprove/trump-approval-rating/kxtrumpapprove-26oct04",
    "seriesUrl": "https://kalshi.com/markets/kxtrumpapprove"
  },
  "rules": {
    "primary": "If Trump's RCP approval average is below 37.9% at exactly 1:00 PM ET on Oct 4, 2026, then the market resolves to Yes.",
    "secondary": "The value in the \"Approve\" column of the \"RCP Average\" row of the table titled \"President Trump Job Approval\" will be the sole resolution source for this event.",
    "contractTermsUrl": "https://assets.kalshi.com/contract_terms/POLITICALSTAT.pdf"
  },
  "settlementSource": {
    "primary": {
      "name": "RealClearPolitics",
      "url": "https://www.realclearpolling.com/polls/approval/donald-trump/approval-rating"
    },
    "all": [
      {
        "name": "RealClearPolitics",
        "url": "https://www.realclearpolling.com/polls/approval/donald-trump/approval-rating"
      }
    ]
  },
  "markets": [
    {
      "ticker": "KXTRUMPAPPROVE-26OCT04-E38.2",
      "label": "38.2%",
      "strike": {
        "type": "between",
        "floor": 38.2,
        "cap": 38.2
      },
      "yesBidCents": 40,
      "yesAskCents": 42,
      "noBidCents": 58,
      "noAskCents": 60,
      "lastCents": 40,
      "bidSize": 92,
      "askSize": 2089.12,
      "volume": 10094.69,
      "volume24h": 10094.69,
      "openInterest": 8103.92,
      "impliedYes": 0.41,
      "impliedYesNormalized": 0.408,
      "house": null,
      "baseRate": null
    },
    {
      "ticker": "KXTRUMPAPPROVE-26OCT04-U37.9",
      "label": "Below 37.9%",
      "strike": {
        "type": "less",
        "floor": null,
        "cap": 37.9
      },
      "yesBidCents": 7,
      "yesAskCents": 10,
      "noBidCents": 90,
      "noAskCents": 93,
      "lastCents": 7,
      "bidSize": 502.86,
      "askSize": 86,
      "volume": 2104.71,
      "volume24h": 1303.63,
      "openInterest": 1978.76,
      "impliedYes": 0.085,
      "impliedYesNormalized": 0.0846,
      "house": null,
      "baseRate": null
    },
    {
      "ticker": "KXTRUMPAPPROVE-26OCT04-E37.9",
      "label": "37.9%",
      "strike": {
        "type": "between",
        "floor": 37.9,
        "cap": 37.9
      },
      "yesBidCents": 5,
      "yesAskCents": 6,
      "noBidCents": 94,
      "noAskCents": 95,
      "lastCents": 12,
      "bidSize": 41,
      "askSize": 44.01,
      "volume": 1019.86,
      "volume24h": 1019.86,
      "openInterest": 957.6,
      "impliedYes": 0.055,
      "impliedYesNormalized": 0.0547,
      "house": null,
      "baseRate": null
    },
    {
      "ticker": "KXTRUMPAPPROVE-26OCT04-E38.3",
      "label": "38.3%",
      "strike": {
        "type": "between",
        "floor": 38.3,
        "cap": 38.3
      },
      "yesBidCents": 5,
      "yesAskCents": 6,
      "noBidCents": 94,
      "noAskCents": 95,
      "lastCents": 5,
      "bidSize": 6974.66,
      "askSize": 3855.06,
      "volume": 560.18,
      "volume24h": 560.18,
      "openInterest": 244.39,
      "impliedYes": 0.055,
      "impliedYesNormalized": 0.0547,
      "house": null,
      "baseRate": null
    },
    {
      "ticker": "KXTRUMPAPPROVE-26OCT04-E38.1",
      "label": "38.1%",
      "strike": {
        "type": "between",
        "floor": 38.1,
        "cap": 38.1
      },
      "yesBidCents": 22,
      "yesAskCents": 26,
      "noBidCents": 74,
      "noAskCents": 78,
      "lastCents": 26,
      "bidSize": 603.88,
      "askSize": 5.7,
      "volume": 560.07,
      "volume24h": 556.42,
      "openInterest": 399.75,
      "impliedYes": 0.24,
      "impliedYesNormalized": 0.2388,
      "house": null,
      "baseRate": null
    },
    {
      "ticker": "KXTRUMPAPPROVE-26OCT04-A38.5",
      "label": "Above 38.5%",
      "strike": {
        "type": "greater",
        "floor": 38.5,
        "cap": null
      },
      "yesBidCents": 1,
      "yesAskCents": 2,
      "noBidCents": 98,
      "noAskCents": 99,
      "lastCents": 2,
      "bidSize": 34170.47,
      "askSize": 18775.04,
      "volume": 249.12,
      "volume24h": 249.12,
      "openInterest": 249.12,
      "impliedYes": 0.015,
      "impliedYesNormalized": 0.0149,
      "house": null,
      "baseRate": {
        "band": "longshot",
        "scope": "category",
        "category": "Politics",
        "horizonHours": 24,
        "n": 41,
        "yesCount": 2,
        "yesRate": 0.0488,
        "yesRate95": [
          0.0135,
          0.1614
        ],
        "avgYesAsk": 0.0341
      }
    },
    {
      "ticker": "KXTRUMPAPPROVE-26OCT04-E38.5",
      "label": "38.5%",
      "strike": {
        "type": "between",
        "floor": 38.5,
        "cap": 38.5
      },
      "yesBidCents": 1,
      "yesAskCents": 2,
      "noBidCents": 98,
      "noAskCents": 99,
      "lastCents": 1,
      "bidSize": 49829.36,
      "askSize": 17275.88,
      "volume": 204.07,
      "volume24h": 204.07,
      "openInterest": 204.07,
      "impliedYes": 0.015,
      "impliedYesNormalized": 0.0149,
      "house": null,
      "baseRate": {
        "band": "longshot",
        "scope": "category",
        "category": "Politics",
        "horizonHours": 24,
        "n": 41,
        "yesCount": 2,
        "yesRate": 0.0488,
        "yesRate95": [
          0.0135,
          0.1614
        ],
        "avgYesAsk": 0.0341
      }
    },
    {
      "ticker": "KXTRUMPAPPROVE-26OCT04-E38.4",
      "label": "38.4%",
      "strike": {
        "type": "between",
        "floor": 38.4,
        "cap": 38.4
      },
      "yesBidCents": 1,
      "yesAskCents": 2,
      "noBidCents": 98,
      "noAskCents": 99,
      "lastCents": 1,
      "bidSize": 68329.28,
      "askSize": 5769.11,
      "volume": 128.71,
      "volume24h": 128.71,
      "openInterest": 128.71,
      "impliedYes": 0.015,
      "impliedYesNormalized": 0.0149,
      "house": null,
      "baseRate": {
        "band": "longshot",
        "scope": "category",
        "category": "Politics",
        "horizonHours": 24,
        "n": 41,
        "yesCount": 2,
        "yesRate": 0.0488,
        "yesRate95": [
          0.0135,
          0.1614
        ],
        "avgYesAsk": 0.0341
      }
    },
    {
      "ticker": "KXTRUMPAPPROVE-26OCT04-E38.0",
      "label": "38.0%",
      "strike": {
        "type": "between",
        "floor": 38,
        "cap": 38
      },
      "yesBidCents": 11,
      "yesAskCents": 12,
      "noBidCents": 88,
      "noAskCents": 89,
      "lastCents": 11,
      "bidSize": 1220.77,
      "askSize": 121,
      "volume": 23.22,
      "volume24h": 23.22,
      "openInterest": 22.22,
      "impliedYes": 0.115,
      "impliedYesNormalized": 0.1144,
      "house": null,
      "baseRate": null
    }
  ],
  "book": {
    "markets": 9,
    "volume24h": 14139.9,
    "openInterest": 12288.54,
    "midSum": 1.005
  },
  "house": {
    "model": null,
    "status": "no-model",
    "reason": "the house has no model for this market; the brief carries market-implied odds and the category base rate",
    "evidence": [],
    "usableAs": null
  },
  "baseRate": {
    "category": {
      "category": "Politics",
      "horizonHours": 24,
      "markets": 119,
      "brierOfMid": 0.0809,
      "longshot": {
        "n": 41,
        "yesCount": 2,
        "yesRate": 0.0488,
        "yesRate95": [
          0.0135,
          0.1614
        ],
        "avgYesAsk": 0.0341
      },
      "favorite": {
        "n": 8,
        "yesCount": 8,
        "yesRate": 1,
        "yesRate95": [
          0.6756,
          1
        ],
        "avgYesAsk": 0.9716
      },
      "source": "content/config/kalshi-category-base-rates.json",
      "window": [
        "2026-09-29",
        "2026-10-03"
      ]
    },
    "family": null
  },
  "whatWouldMoveIt": [
    "New polling, official announcements or filings, and statements by the named officials.",
    "The publication schedule of the named poll or tracker.",
    "A rules clarification or settlement-source change published by Kalshi on the market page.",
    "Order-book depth: thin books move on small orders, so a large price move on little volume says little."
  ],
  "opportunities": [],
  "provenance": [
    {
      "what": "Kalshi market data (event, markets, series)",
      "url": "https://api.elections.kalshi.com/trade-api/v2/events/KXTRUMPAPPROVE-26OCT04",
      "fetchedAt": "2026-10-03T20:15:12.469Z"
    },
    {
      "what": "Category base rates",
      "url": null,
      "fetchedAt": "2026-10-03"
    }
  ],
  "disclosure": "Built from public information (Kalshi market data, the contract rules, and public data sources). Odds are a snapshot, not a prediction of the future and not financial advice. Prediction-market contracts can lose their entire price."
}
