{
  "type": "KalshiMarketBrief",
  "version": 1,
  "briefId": "KXLOLGAME-26OCT031600C9LY@20261003T201512Z",
  "asOf": "2026-10-03T20:15:12.469Z",
  "event": {
    "eventTicker": "KXLOLGAME-26OCT031600C9LY",
    "seriesTicker": "KXLOLGAME",
    "title": "Cloud9 vs. LYON",
    "subTitle": "Cloud9 vs. LYON (Oct 3)",
    "category": "Sports",
    "frequency": "custom",
    "mutuallyExclusive": true,
    "tags": [
      "Esports"
    ],
    "closesAt": "2026-10-05T20:00:00.000Z",
    "expectedSettleAt": "2026-10-04T00:00:00.000Z",
    "settlesOn": "2026-10-04",
    "hoursToClose": 3.75,
    "feeMultiplier": 1,
    "url": "https://kalshi.com/markets/kxlolgame/league-of-legends-game/kxlolgame-26oct031600c9ly",
    "seriesUrl": "https://kalshi.com/markets/kxlolgame"
  },
  "rules": {
    "primary": "If Cloud9 wins the LCS 2026: Cloud9 vs. LYON League of Legends match originally scheduled for Oct 3, 2026 at 4:00 PM EDT, then the market resolves to Yes.",
    "secondary": "The following market refers to the full match in the LCS 2026: Cloud9 vs. LYON League of Legends match originally scheduled for Oct 3, 2026 at 4:00 PM EDT\nIf the relevant match is postponed and not started within 48 hours of its originally scheduled start time, the market will resolve to the fair market price.\nIf the relevant match is cancelled before play begins, the market will resolve to the fair market price.\nIf the relevant match is forfeited before any play occurs, the market will resolve to the fair market price.\nIf the relevant match begins and is subsequently forfeited, the market will resolve according to the official result published by the governing body or tournament organizer.\n\nKalshi is not affiliated, associated, authorized, endorsed by, or in any way officially connected with the Governing League. All trademarks, logos, and brand names are the property of their respective owners.",
    "contractTermsUrl": "https://assets.kalshi.com/contract_terms/ESPORTSWIN.pdf"
  },
  "settlementSource": {
    "primary": {
      "name": "Sofascore",
      "url": "https://www.sofascore.com/esports/lol"
    },
    "all": [
      {
        "name": "Sofascore",
        "url": "https://www.sofascore.com/esports/lol"
      },
      {
        "name": "BO3",
        "url": "https://bo3.gg/lol/matches/finished"
      },
      {
        "name": "Gamers World",
        "url": "https://egamersworld.com/"
      }
    ]
  },
  "markets": [
    {
      "ticker": "KXLOLGAME-26OCT031600C9LY-LY",
      "label": "LYON",
      "strike": {
        "type": "structured",
        "floor": null,
        "cap": null
      },
      "yesBidCents": 69,
      "yesAskCents": 70,
      "noBidCents": 30,
      "noAskCents": 31,
      "lastCents": 69,
      "bidSize": 51.7,
      "askSize": 6224.99,
      "volume": 142319.29,
      "volume24h": 111168.38,
      "openInterest": 130474.66,
      "impliedYes": 0.695,
      "impliedYesNormalized": 0.6881,
      "house": null,
      "baseRate": null
    },
    {
      "ticker": "KXLOLGAME-26OCT031600C9LY-C9",
      "label": "Cloud9",
      "strike": {
        "type": "structured",
        "floor": null,
        "cap": null
      },
      "yesBidCents": 31,
      "yesAskCents": 32,
      "noBidCents": 68,
      "noAskCents": 69,
      "lastCents": 33,
      "bidSize": 471.98,
      "askSize": 329,
      "volume": 83851,
      "volume24h": 73351.62,
      "openInterest": 80034.68,
      "impliedYes": 0.315,
      "impliedYesNormalized": 0.3119,
      "house": null,
      "baseRate": null
    }
  ],
  "book": {
    "markets": 2,
    "volume24h": 184520,
    "openInterest": 210509.34,
    "midSum": 1.01
  },
  "house": {
    "model": null,
    "status": "no-model",
    "reason": "the house has no model for this market; the brief carries market-implied odds and the category base rate",
    "evidence": [],
    "usableAs": null
  },
  "baseRate": {
    "category": {
      "category": "Sports",
      "horizonHours": 6,
      "markets": 1013,
      "brierOfMid": 0.1789,
      "longshot": {
        "n": 47,
        "yesCount": 1,
        "yesRate": 0.0213,
        "yesRate95": [
          0.0038,
          0.1111
        ],
        "avgYesAsk": 0.0332
      },
      "favorite": {
        "n": 20,
        "yesCount": 20,
        "yesRate": 1,
        "yesRate95": [
          0.8389,
          1
        ],
        "avgYesAsk": 0.9665
      },
      "source": "content/config/kalshi-category-base-rates.json",
      "window": [
        "2026-09-29",
        "2026-10-03"
      ]
    },
    "family": null
  },
  "whatWouldMoveIt": [
    "Lineup and injury news, and the live game state once play starts.",
    "Postponement or cancellation under the rules' fair-price clause.",
    "A rules clarification or settlement-source change published by Kalshi on the market page.",
    "Order-book depth: thin books move on small orders, so a large price move on little volume says little."
  ],
  "opportunities": [],
  "provenance": [
    {
      "what": "Kalshi market data (event, markets, series)",
      "url": "https://api.elections.kalshi.com/trade-api/v2/events/KXLOLGAME-26OCT031600C9LY",
      "fetchedAt": "2026-10-03T20:15:12.469Z"
    },
    {
      "what": "Category base rates",
      "url": null,
      "fetchedAt": "2026-10-03"
    }
  ],
  "disclosure": "Built from public information (Kalshi market data, the contract rules, and public data sources). Odds are a snapshot, not a prediction of the future and not financial advice. Prediction-market contracts can lose their entire price."
}
